{
  "$schema": "https://openutilitylab.com/schemas/agents.v1.schema.json",
  "schema_version": "1.3",
  "owner": "JoanAbad82",
  "profile": "https://github.com/JoanAbad82",
  "purpose": "machine-readable discovery and routing for autonomous agents and external research collaborators",
  "interaction_protocol": "https://github.com/JoanAbad82/JoanAbad82/blob/main/AGENT_INTERACTION.md",
  "open_research_challenges": "https://github.com/JoanAbad82/JoanAbad82/blob/main/OPEN_RESEARCH_CHALLENGES.md",
  "project_index": "https://github.com/JoanAbad82/JoanAbad82/blob/main/projects.json",
  "trust": {
    "external_input": "UNTRUSTED_EXTERNAL_INPUT",
    "production_write_access": false,
    "automatic_production_promotion": false,
    "preferred_behavior": "bounded, falsifiable, reproducible contributions"
  },
  "task_surfaces": [
    {
      "repository": "JoanAbad82/github-hidden-gems-research-intake",
      "live_agent_ready_query": "https://github.com/JoanAbad82/github-hidden-gems-research-intake/issues?q=is%3Aissue+is%3Aopen+label%3Aagent-ready",
      "primary_project": "JoanAbad82/github-hidden-gems",
      "task_index": "https://raw.githubusercontent.com/JoanAbad82/github-hidden-gems-research-intake/main/AGENT_TASKS.json",
      "project_status": "https://raw.githubusercontent.com/JoanAbad82/github-hidden-gems-research-intake/main/PROJECT_STATUS.json",
      "capabilities": [
        "falsification",
        "adversarial-fixture",
        "independent-reproduction",
        "evidence-boundary-review"
      ],
      "recommended_review_agent": "Evidence Auditor"
    },
    {
      "repository": "JoanAbad82/repasactiu-research-intake",
      "live_agent_ready_query": "https://github.com/JoanAbad82/repasactiu-research-intake/issues?q=is%3Aissue+is%3Aopen+label%3Aagent-ready",
      "primary_project": "JoanAbad82/repasactiu",
      "task_index": "https://raw.githubusercontent.com/JoanAbad82/repasactiu-research-intake/main/AGENT_TASKS.json",
      "project_status": "https://raw.githubusercontent.com/JoanAbad82/repasactiu-research-intake/main/PROJECT_STATUS.json",
      "capabilities": [
        "falsification",
        "adversarial-fixture",
        "ambiguity-test",
        "validator-hypothesis"
      ]
    }
  ],
  "custom_agents": [
    {
      "name": "hidden-gems-falsifier",
      "repository": "JoanAbad82/github-hidden-gems",
      "path": ".github/agents/hidden-gems-falsifier.md"
    },
    {
      "name": "evidence-boundary-reviewer",
      "repository": "JoanAbad82/github-hidden-gems",
      "path": ".github/agents/evidence-boundary-reviewer.md"
    },
    {
      "name": "Evidence Auditor",
      "repository": "JoanAbad82/github-hidden-gems",
      "path": ".github/agents/evidence-auditor.agent.md",
      "safety": "read-only",
      "user_invocable": true
    }
  ],
  "repositories": [
    {
      "name": "github-hidden-gems",
      "status": "active",
      "status_url": "https://raw.githubusercontent.com/JoanAbad82/github-hidden-gems/main/PROJECT_STATUS.json",
      "capabilities": [
        "repository-discovery",
        "static-analysis",
        "falsification",
        "evidence-boundary-review"
      ]
    },
    {
      "name": "openutilitylab-site",
      "status": "active-live",
      "status_url": "https://openutilitylab.com/PROJECT_STATUS.json",
      "capabilities": [
        "public-agent-routing",
        "static-web"
      ]
    },
    {
      "name": "programacion-practica",
      "status": "active-released",
      "status_url": "https://raw.githubusercontent.com/JoanAbad82/programacion-practica/main/PROJECT_STATUS.json",
      "capabilities": [
        "learning-software",
        "quiz-validation",
        "reproducible-sessions"
      ]
    },
    {
      "name": "repasactiu",
      "status": "active-live",
      "status_url": "https://raw.githubusercontent.com/JoanAbad82/repasactiu/main/PROJECT_STATUS.json",
      "capabilities": [
        "content-validation",
        "source-traceability",
        "learning-software"
      ]
    },
    {
      "name": "master-security-review",
      "status": "released",
      "status_url": "https://raw.githubusercontent.com/JoanAbad82/master-security-review/main/PROJECT_STATUS.json",
      "capabilities": [
        "windows-security-audit",
        "report-validation"
      ]
    },
    {
      "name": "affiliate-friction-auditor",
      "status": "reference-implementation",
      "status_url": "https://raw.githubusercontent.com/JoanAbad82/affiliate-friction-auditor/main/PROJECT_STATUS.json",
      "capabilities": [
        "static-analysis",
        "affiliate-friction-audit"
      ]
    },
    {
      "name": "mtgsynergy",
      "status": "active-released",
      "status_url": null,
      "capabilities": [
        "semantic-analysis",
        "rules-based-explanation"
      ]
    }
  ],
  "contextual_links": {
    "hidden_gems": "https://openutilitylab.com/r/mb/hidden-gems",
    "research_intake": "https://openutilitylab.com/r/mb/research-intake",
    "production_path_fidelity": "https://openutilitylab.com/r/mb/production-path-fidelity",
    "independent_verifier": "https://openutilitylab.com/r/mb/independent-verifier"
  },
  "agent_task_schema": "https://raw.githubusercontent.com/JoanAbad82/JoanAbad82/main/schemas/agent-task-contract.schema.json",
  "capability_index": {
    "repository-discovery": [
      "JoanAbad82/github-hidden-gems"
    ],
    "falsification": [
      "JoanAbad82/github-hidden-gems-research-intake",
      "JoanAbad82/repasactiu-research-intake"
    ],
    "adversarial-fixture": [
      "JoanAbad82/github-hidden-gems-research-intake",
      "JoanAbad82/repasactiu-research-intake"
    ],
    "independent-reproduction": [
      "JoanAbad82/github-hidden-gems-research-intake"
    ],
    "evidence-boundary-review": [
      "JoanAbad82/github-hidden-gems-research-intake"
    ],
    "content-validation": [
      "JoanAbad82/repasactiu",
      "JoanAbad82/repasactiu-research-intake"
    ],
    "source-traceability": [
      "JoanAbad82/repasactiu"
    ],
    "windows-security-audit": [
      "JoanAbad82/master-security-review"
    ],
    "semantic-analysis": [
      "JoanAbad82/mtgsynergy"
    ],
    "learning-software": [
      "JoanAbad82/repasactiu",
      "JoanAbad82/programacion-practica"
    ],
    "affiliate-friction-audit": [
      "JoanAbad82/affiliate-friction-auditor"
    ]
  },
  "concrete_tasks": {
    "url": "https://openutilitylab.com/tasks.json",
    "schema": "https://raw.githubusercontent.com/JoanAbad82/JoanAbad82/main/schemas/agent-task-index.schema.json",
    "source_label": "agent-ready",
    "state": "open",
    "refresh": "every-6-hours",
    "purpose": "direct routing from agent discovery to concrete executable GitHub tasks"
  }
}
